Diện tích,Mặt tiền,Mức giá,Số tầng,Số phòng ngủ,Số toilet,Pháp lý,Nội thất,Hướng nhà,Hướng ban công,Đường vào,Ngày đăng,Ngày hết hạn,Loại tin,Địa chỉ
225 m²,,75 tỷ,7 tầng,,,,,,,,10/11/2023,20/11/2023,Tin thường,"Đường Đinh Tiên Hoàng, Phường Đa Kao, Quận 1, Hồ Chí Minh"
166 m²,,40 tỷ,,,,Sổ đỏ/ Sổ hồng,Đầy đủ,,,,11/11/2023,21/11/2023,Tin thường,"Đường Cô Giang, Phường Cô Giang, Quận 1, Hồ Chí Minh"
288 m²,,65 tỷ,1 tầng,1 phòng,1 phòng,,,,,,15/11/2023,25/11/2023,Tin thường,"Đường Yersin, Phường Phạm Ngũ Lão, Quận 1, Hồ Chí Minh"
"69,9 m²",,"17,5 tỷ",4 tầng,6 phòng,7 phòng,Sổ đỏ/ Sổ hồng,,Đông - Nam,,,15/11/2023,25/11/2023,Tin thường,"Đường Nguyễn Phi Khanh, Phường Tân Định, Quận 1, Hồ Chí Minh"
"92,5 m²",,50 tỷ,,,,,,,,,13/11/2023,23/11/2023,Tin thường,"Đường Tôn Thất Tùng, Phường Bến Thành, Quận 1, Hồ Chí Minh"
108 m²,,60 tỷ,,,,,,,,,15/11/2023,25/11/2023,Tin thường,"Đường Lê Thánh Tôn, Phường Bến Thành, Quận 1, Hồ Chí Minh"
266 m²,,89 tỷ,,,,,,,,,15/11/2023,25/11/2023,Tin thường,"Đường Sương Nguyệt Ánh, Phường Bến Thành, Quận 1, Hồ Chí Minh"
160 m²,,55 tỷ,,,,Sổ đỏ/ Sổ hồng,Đầy đủ,,,,15/11/2023,25/11/2023,Tin thường,"Đường Phạm Hồng Thái, Phường Bến Thành, Quận 1, Hồ Chí Minh"
128 m²,"4,5 m",75 tỷ,2 tầng,,,Sổ đỏ/ Sổ hồng.,Đầy đủ.,,,20 m,15/11/2023,25/11/2023,Tin thường,"Đường Nguyễn Trãi, Phường Bến Thành, Quận 1, Hồ Chí Minh"
