Diện tích,Mặt tiền,Mức giá,Số tầng,Số phòng ngủ,Số toilet,Pháp lý,Nội thất,Hướng nhà,Hướng ban công,Đường vào,Ngày đăng,Ngày hết hạn,Loại tin,Địa chỉ
"33,6 m²","4,2 m","8,8 tỷ",4 tầng,6 phòng,6 phòng,Sổ đỏ/ Sổ hồng,,,,20 m,17/11/2023,02/12/2023,Tin thường,"Đường Hoàng Sa, Phường 9, Quận 3, Hồ Chí Minh"
375 m²,,110 tỷ,2 tầng,,,,,,,,15/11/2023,25/11/2023,Tin thường,"Đường Cao Thắng, Phường 4, Quận 3, Hồ Chí Minh"
50 m²,4 m,13 tỷ,5 tầng,4 phòng,4 phòng,,,,,20 m,17/11/2023,02/12/2023,Tin thường,"Đường Hoàng Sa, Phường Võ Thị Sáu, Quận 3, Hồ Chí Minh"
86 m²,"4,4 m",Thỏa thuận,2 tầng,3 phòng,3 phòng,Sổ đỏ/ Sổ hồng,Cơ bản,,,30 m,17/11/2023,02/12/2023,Tin thường,"Đường Lê Văn Sỹ, Phường 14, Quận 3, Hồ Chí Minh"
610 m²,,200 tỷ,,,,Sổ đỏ/ Sổ hồng,,,,,17/11/2023,27/11/2023,Tin thường,"Đường Trần Quốc Thảo, Phường 7, Quận 3, Hồ Chí Minh"
156 m²,10 m,50 tỷ,7 tầng,,,,,,,,14/11/2023,24/11/2023,Tin thường,"Đường Lý Thái Tổ, Phường 2, Quận 3, Hồ Chí Minh"
719 m²,,450 tỷ,14 tầng,,,,,,,,14/11/2023,24/11/2023,Tin thường,"Đường Võ Văn Tần, Phường Võ Thị Sáu, Quận 3, Hồ Chí Minh"
396 m²,,150 tỷ,,,,,,,,,13/11/2023,23/11/2023,Tin thường,"Đường Nguyễn Đình Chiểu, Phường 6, Quận 3, Hồ Chí Minh"
200 m²,,50 tỷ,6 tầng,5 phòng,5 phòng,Sổ đỏ/ Sổ hồng,Đầy đủ,,,,16/11/2023,26/11/2023,Tin thường,"Đường Lê Văn Sỹ, Phường 12, Quận 3, Hồ Chí Minh"
