Diện tích,Mặt tiền,Mức giá,Số tầng,Số phòng ngủ,Số toilet,Pháp lý,Nội thất,Hướng nhà,Hướng ban công,Đường vào,Ngày đăng,Ngày hết hạn,Loại tin,Địa chỉ
"125,7 m²","6,7 m","7,2 tỷ",1 tầng,2 phòng,1 phòng,,,Đông - Bắc,,6 m,13/11/2023,23/11/2023,Tin thường,"Đường Nguyễn Văn Tăng, Phường Long Thạnh Mỹ, Quận 9, Hồ Chí Minh"
75 m²,"4,04 m","6,5 tỷ",4 tầng,4 phòng,3 phòng,Sổ đỏ/ Sổ hồng,Đầy đủ,Tây - Nam,,,13/11/2023,23/11/2023,Tin thường,"Dự án Khu dân cư Gò Cát 2, Đường Gò Cát, Phường Phú Hữu, Quận 9, Hồ Chí Minh"
40 m²,,Thỏa thuận,,2 phòng,1 phòng,,,,,3 m,13/11/2023,23/11/2023,Tin thường,"Đường Lê Văn Việt, Phường Tăng Nhơn Phú A, Quận 9, Hồ Chí Minh"
50 m²,,"4,7 tỷ",3 tầng,3 phòng,3 phòng,Sổ đỏ/ Sổ hồng,,,,,13/11/2023,23/11/2023,Tin thường,"Đường Bưng Ông Thoàn, Phường Phú Hữu, Quận 9, Hồ Chí Minh"
52 m²,,"5,3 tỷ",4 tầng,4 phòng,4 phòng,Sổ đỏ/ Sổ hồng,,,,6 m,13/11/2023,23/11/2023,Tin thường,"Đường Bưng Ông Thoàn, Phường Phú Hữu, Quận 9, Hồ Chí Minh"
173 m²,"7,5 m",53 triệu/m²,1 tầng,6 phòng,6 phòng,,,,,,07/11/2023,17/11/2023,Tin thường,"Đường 31, Phường Long Thạnh Mỹ, Quận 9, Hồ Chí Minh"
117 m²,"5,5 m","9,2 tỷ",4 tầng,6 phòng,6 phòng,,,,,7 m,13/11/2023,23/11/2023,Tin thường,"Đường 68, Phường Hiệp Phú, Quận 9, Hồ Chí Minh"
90 m²,5 m,6 tỷ,2 tầng,2 phòng,2 phòng,,,,,5 m,12/11/2023,22/11/2023,Tin thường,"Đường Tây Hòa, Phường Phước Long A, Quận 9, Hồ Chí Minh"
53 m²,,"3,7 tỷ",,2 phòng,1 phòng,Sổ đỏ/ Sổ hồng,Đầy đủ,,,6 m,13/11/2023,23/11/2023,Tin thường,"Đường Làng Tăng Phú, Phường Tăng Nhơn Phú A, Quận 9, Hồ Chí Minh"
