Diện tích,Mức giá,Số phòng ngủ,Số toilet,Pháp lý,Nội thất,Hướng nhà,Hướng ban công,Ngày đăng,Ngày hết hạn,Loại tin,Địa chỉ
96 m²,"5,37 tỷ",3 phòng,2 phòng,Sổ đỏ/ Sổ hồng,Đầy đủ,,,04/10/2023,03/11/2023,Tin thường,"Dự án Opal Garden, Đường 20, Phường Hiệp Bình Chánh, Thủ Đức, Hồ Chí Minh"
30 m²,"1,15 tỷ",1 phòng,1 phòng,Hợp đồng mua bán,Cơ bản,,,02/10/2023,01/11/2023,Tin thường,"Dự án Prosper Phố Đông, Đường Tô Ngọc Vân, Phường Tam Bình, Thủ Đức, Hồ Chí Minh"
38 m²,"2,6 tỷ",1 phòng,1 phòng,Hợp đồng quyền đặt cọc,Cơ bản,Tây,Đông,30/09/2023,30/10/2023,Tin thường,"Dự án Avatar Thủ Đức, Đường Vành Đai 2, Phường Trường Thọ, Thủ Đức, Hồ Chí Minh"
77 m²,Thỏa thuận,2 phòng,2 phòng,Hợp đồng mua bán,Cơ bản,Đông - Nam,,25/10/2023,04/11/2023,Tin thường,"Dự án Vung Tau Centre Point, Đường 2/9, Phường Nguyễn An Ninh, Vũng Tàu, Bà Rịa Vũng Tàu"
"86,2 m²","4,8 tỷ",3 phòng,,Sổ hồng,Full NT.,Tây - Nam,Đông - Bắc,22/10/2023,01/11/2023,Tin thường,"Dự án Opal Garden, Đường 20, Phường Hiệp Bình Chánh, Thủ Đức, Hồ Chí Minh"
